{
  "$schema": "../../../../schema/class.schema.json",
  "id": "exemplar",
  "name": "Exemplar",
  "status": "expansion",
  "source": {
    "title": "War of Immortals",
    "date": "2024-10",
    "url": "https://2e.aonprd.com/Classes.aspx?ID=65"
  },
  "group": "martial",
  "keyAttributes": [
    "str",
    "dex"
  ],
  "traditions": [],
  "casting": null,
  "hp": 10,
  "ratings": {
    "offense": [
      4,
      5
    ],
    "defense": [
      3,
      4
    ],
    "support": [
      2,
      4
    ],
    "utility": [
      2,
      3
    ],
    "difficulty": 3.5
  },
  "features": [
    {
      "title": "Touched by divinity",
      "text": "Exemplars carry a divine spark in three ikons, special weapons, worn items or parts of their body. One ikon holds the spark at a time."
    },
    {
      "title": "Spark transcendence",
      "text": "The active ikon grants an ongoing benefit. Release its special power to move the spark to another ikon and gain that ikon's benefit."
    }
  ],
  "iconic": {
    "name": "Nahoa"
  },
  "art": {
    "emblem": "../../../emblems/exemplar.svg",
    "paizo": {
      "pack": "cup-pf2e-iconics",
      "file": "PNG/Exemplar - Nahoa.png"
    },
    "local": "exemplar"
  },
  "links": {
    "archivesOfNethys": "https://2e.aonprd.com/Classes.aspx?ID=65"
  },
  "review": {
    "reviewedOn": "2026-10-05",
    "rulesVersion": "War of Immortals",
    "sources": [
      "https://2e.aonprd.com/Classes.aspx?ID=65"
    ],
    "notes": "Original September 2026 numbers retained for comparison; corrected summaries and class families. These scores predate the revised rubric.",
    "ratings": {
      "offense": "Historical score: 4–5. Preserved from the original project dataset; consult the revised set for a current rationale.",
      "defense": "Historical score: 3–4. Preserved from the original project dataset; consult the revised set for a current rationale.",
      "support": "Historical score: 2–4. Preserved from the original project dataset; consult the revised set for a current rationale.",
      "utility": "Historical score: 2–3. Preserved from the original project dataset; consult the revised set for a current rationale.",
      "difficulty": "Historical score: 3.5. Preserved from the original project dataset; consult the revised set for a current rationale."
    }
  }
}
