{
  "$schema": "../../../../schema/class.schema.json",
  "id": "sorcerer",
  "name": "Sorcerer",
  "status": "core",
  "source": {
    "title": "Player Core 2",
    "date": "2024-08",
    "url": "https://2e.aonprd.com/Classes.aspx?ID=62"
  },
  "group": "spellcasters",
  "keyAttributes": [
    "cha"
  ],
  "traditions": [
    "arcane",
    "divine",
    "occult",
    "primal"
  ],
  "traditionsChosen": true,
  "casting": "spontaneous",
  "hp": 6,
  "ratings": {
    "offense": [
      2,
      3.5
    ],
    "defense": 1,
    "support": [
      3,
      5
    ],
    "utility": 4,
    "difficulty": 2.5
  },
  "features": [
    {
      "title": "Born with magic",
      "text": "Your bloodline determines your tradition, extra spells and blood magic effects. Choose a repertoire that fits a damage, healing, control or mixed role."
    },
    {
      "title": "Sorcerous Potency",
      "text": "A generous supply of spell slots and a bonus to slotted spell damage or healing support powerful casting. Bloodline focus spells provide further signature abilities."
    }
  ],
  "iconic": {
    "name": "Seoni",
    "ancestry": "human"
  },
  "art": {
    "emblem": "../../../emblems/sorcerer.svg",
    "paizo": {
      "pack": "cup-pf2e-iconics",
      "file": "PNG/Sorcerer - Seoni.png"
    },
    "local": "sorcerer"
  },
  "links": {
    "archivesOfNethys": "https://2e.aonprd.com/Classes.aspx?ID=62"
  },
  "review": {
    "reviewedOn": "2026-10-05",
    "rulesVersion": "Player Core 2",
    "sources": [
      "https://2e.aonprd.com/Classes.aspx?ID=62"
    ],
    "notes": "Original September 2026 numbers retained for comparison; corrected summaries and class families. These scores predate the revised rubric.",
    "ratings": {
      "offense": "Historical score: 2–3.5. Preserved from the original project dataset; consult the revised set for a current rationale.",
      "defense": "Historical score: 1. Preserved from the original project dataset; consult the revised set for a current rationale.",
      "support": "Historical score: 3–5. Preserved from the original project dataset; consult the revised set for a current rationale.",
      "utility": "Historical score: 4. Preserved from the original project dataset; consult the revised set for a current rationale.",
      "difficulty": "Historical score: 2.5. Preserved from the original project dataset; consult the revised set for a current rationale."
    }
  }
}
