{
  "$schema": "../../schema/class.schema.json",
  "id": "runesmith",
  "name": "Runesmith",
  "status": "expansion",
  "source": {
    "title": "Impossible Magic",
    "date": "2026-07"
  },
  "group": "moderate-magic",
  "keyAttributes": [
    "int"
  ],
  "traditions": [],
  "casting": null,
  "hp": 8,
  "ratings": {
    "offense": 3.5,
    "defense": 3,
    "support": 4,
    "utility": 3.5,
    "difficulty": 4.5
  },
  "features": [
    {
      "title": "Etch and trace",
      "text": "Runesmiths draw magic runes on creatures and equipment. Etched runes last until spent or removed, while traced runes fade at the end of the next turn."
    },
    {
      "title": "Invoke Rune",
      "text": "Runes grant ongoing effects. Invoking a rune releases its power and consumes it, so the choice is whether to keep its benefit or spend it."
    }
  ],
  "iconic": {
    "name": "Pallemi"
  },
  "art": {
    "emblem": "../emblems/runesmith.svg",
    "local": "runesmith"
  },
  "links": {
    "archivesOfNethys": "https://2e.aonprd.com/Classes.aspx?ID=76"
  }
}
