{
  "$schema": "../../schema/class.schema.json",
  "id": "solarian",
  "name": "Solarian",
  "status": "core",
  "source": {
    "title": "Starfinder Player Core",
    "date": "2025-07",
    "url": "https://2e.aonsrd.com/classes/4-solarian"
  },
  "group": "supernatural",
  "keyAttributes": [
    "str"
  ],
  "traditions": [],
  "casting": null,
  "hp": 10,
  "ratings": {
    "offense": [
      4,
      5
    ],
    "defense": [
      3.5,
      4.5
    ],
    "support": [
      2,
      3.5
    ],
    "utility": [
      2,
      3
    ],
    "difficulty": 3.5
  },
  "features": [
    {
      "title": "Warrior of the stars",
      "text": "Solarians form weapons from stellar energy. Photon power favors damage and light, while graviton power pulls enemies around and hinders them."
    },
    {
      "title": "Attunement",
      "text": "Cycle actions switch between photon and graviton. Powerful disharmony abilities leave the solarian unattuned, so they must attune again to regain those benefits."
    }
  ],
  "iconic": {
    "name": "Dae",
    "ancestry": "pahtra"
  },
  "art": {
    "emblem": "../emblems/solarian.svg",
    "paizo": {
      "pack": "cup-sf2e-iconics",
      "file": "PNG/Solarian - Dae.png"
    },
    "local": "solarian"
  },
  "links": {
    "archivesOfNethys": "https://2e.aonsrd.com/classes/4-solarian"
  },
  "review": {
    "reviewedOn": "2026-10-05",
    "rulesVersion": "Starfinder Player Core",
    "sources": [
      "https://2e.aonsrd.com/classes/4-solarian"
    ],
    "notes": "Editorial assessment of the class framework and ordinary builds. Rules references support mechanics; scores remain judgments.",
    "ratings": {
      "offense": "4–4.5 → 4–5. Solar weapons and offensive stellar choices support strong martial damage.",
      "defense": "3.5 → 3.5–4.5. Solar shield and defensive choices can substantially improve resilience.",
      "support": "2–3 → 2–3.5. Selected stellar effects offer control or protection; offensive builds contribute less here.",
      "utility": "2 → 2–3. Stellar mobility and selected abilities offer focused exploration tools.",
      "difficulty": "3.5 → 3.5. Track attunement, graviton/photon choices and positioning."
    }
  }
}
