{
  "$schema": "../../../../schema/class.schema.json",
  "id": "swashbuckler",
  "name": "Swashbuckler",
  "status": "core",
  "source": {
    "title": "Player Core 2",
    "date": "2024-08",
    "url": "https://2e.aonprd.com/Classes.aspx?ID=63"
  },
  "group": "martial",
  "keyAttributes": [
    "dex"
  ],
  "traditions": [],
  "casting": null,
  "hp": 10,
  "ratings": {
    "offense": 4,
    "defense": 3.5,
    "support": 3,
    "utility": 2.5,
    "difficulty": 3
  },
  "features": [
    {
      "title": "Daring duelist",
      "text": "Your style turns a favored skill into a combat tool, from athletic maneuvers to social tricks. Build for precision damage, defense or helping allies create openings."
    },
    {
      "title": "Panache and finishers",
      "text": "Build panache through bravado actions, then decide when to spend it on a finisher. Remaster rules make gaining panache more forgiving, but action order still matters."
    }
  ],
  "iconic": {
    "name": "Jirelle",
    "ancestry": "human"
  },
  "art": {
    "emblem": "../../../emblems/swashbuckler.svg",
    "paizo": {
      "pack": "cup-pf2e-iconics",
      "file": "PNG/Swashbuckler - Jirrelle.png"
    },
    "local": "swashbuckler"
  },
  "links": {
    "archivesOfNethys": "https://2e.aonprd.com/Classes.aspx?ID=63"
  },
  "review": {
    "reviewedOn": "2026-10-05",
    "rulesVersion": "Player Core 2",
    "sources": [
      "https://2e.aonprd.com/Classes.aspx?ID=63"
    ],
    "notes": "Original September 2026 numbers retained for comparison; corrected summaries and class families. These scores predate the revised rubric.",
    "ratings": {
      "offense": "Historical score: 4. Preserved from the original project dataset; consult the revised set for a current rationale.",
      "defense": "Historical score: 3.5. Preserved from the original project dataset; consult the revised set for a current rationale.",
      "support": "Historical score: 3. Preserved from the original project dataset; consult the revised set for a current rationale.",
      "utility": "Historical score: 2.5. Preserved from the original project dataset; consult the revised set for a current rationale.",
      "difficulty": "Historical score: 3. Preserved from the original project dataset; consult the revised set for a current rationale."
    }
  }
}
