{
  "$schema": "../../../../schema/class.schema.json",
  "id": "daredevil",
  "name": "Daredevil",
  "status": "playtest",
  "source": {
    "title": "Risks & Rewards Playtest",
    "date": "2026-02",
    "url": "https://downloads.paizo.com/RisksandRewards_Playtest.pdf"
  },
  "group": "martial",
  "keyAttributes": [
    "str",
    "dex"
  ],
  "traditions": [],
  "casting": null,
  "hp": 8,
  "ratings": {
    "offense": 4,
    "defense": 3,
    "support": 3,
    "utility": 3,
    "difficulty": 4
  },
  "features": [
    {
      "title": "Living on the edge",
      "text": "Daredevils leap into danger, using movement and maneuvers to set up attacks. A daring stunt can knock an enemy down or push them out of position."
    },
    {
      "title": "Adrenaline",
      "text": "Starting a risky action grants adrenaline even if the roll fails. It powers special attacks until the start of the daredevil's next turn."
    }
  ],
  "art": {
    "emblem": "../../../emblems/daredevil.svg",
    "local": "daredevil"
  },
  "review": {
    "reviewedOn": "2026-10-05",
    "rulesVersion": "Risks & Rewards Playtest",
    "sources": [
      "https://downloads.paizo.com/RisksandRewards_Playtest.pdf"
    ],
    "notes": "Original September 2026 numbers retained for comparison; corrected summaries and class families. These scores predate the revised rubric.",
    "ratings": {
      "offense": "Historical score: 4. Preserved from the original project dataset; consult the revised set for a current rationale.",
      "defense": "Historical score: 3. Preserved from the original project dataset; consult the revised set for a current rationale.",
      "support": "Historical score: 3. Preserved from the original project dataset; consult the revised set for a current rationale.",
      "utility": "Historical score: 3. Preserved from the original project dataset; consult the revised set for a current rationale.",
      "difficulty": "Historical score: 4. Preserved from the original project dataset; consult the revised set for a current rationale."
    }
  }
}
