{
  "$schema": "../../../../schema/class.schema.json",
  "id": "inventor",
  "name": "Inventor",
  "status": "expansion",
  "source": {
    "title": "Guns & Gears (Remastered)",
    "date": "2025-02",
    "url": "https://2e.aonprd.com/Classes.aspx?ID=19"
  },
  "group": "martial",
  "keyAttributes": [
    "int"
  ],
  "traditions": [],
  "casting": null,
  "hp": 8,
  "ratings": {
    "offense": 4,
    "defense": 3.5,
    "support": 3,
    "utility": 3,
    "difficulty": 3
  },
  "features": [
    {
      "title": "Brilliant tinkerer",
      "text": "Inventors fight with a signature innovation: custom armor, a construct companion or a one-of-a-kind weapon that they keep improving."
    },
    {
      "title": "Overdrive",
      "text": "Supercharge gear with Crafting and attempt unstable actions such as Explode. A failed flat check blocks further unstable actions until you spend 10 minutes retuning the innovation."
    }
  ],
  "iconic": {
    "name": "Droven"
  },
  "art": {
    "emblem": "../../../emblems/inventor.svg",
    "paizo": {
      "pack": "cup-pf2e-iconics",
      "file": "PNG/Inventor - Droven.png"
    },
    "local": "inventor"
  },
  "links": {
    "archivesOfNethys": "https://2e.aonprd.com/Classes.aspx?ID=19"
  },
  "review": {
    "reviewedOn": "2026-10-05",
    "rulesVersion": "Guns & Gears (Remastered)",
    "sources": [
      "https://2e.aonprd.com/Classes.aspx?ID=19"
    ],
    "notes": "Original September 2026 numbers retained for comparison; corrected summaries and class families. These scores predate the revised rubric.",
    "ratings": {
      "offense": "Historical score: 4. Preserved from the original project dataset; consult the revised set for a current rationale.",
      "defense": "Historical score: 3.5. Preserved from the original project dataset; consult the revised set for a current rationale.",
      "support": "Historical score: 3. Preserved from the original project dataset; consult the revised set for a current rationale.",
      "utility": "Historical score: 3. Preserved from the original project dataset; consult the revised set for a current rationale.",
      "difficulty": "Historical score: 3. Preserved from the original project dataset; consult the revised set for a current rationale."
    }
  }
}
