{
  "$schema": "../../../../schema/class.schema.json",
  "id": "mystic",
  "name": "Mystic",
  "status": "core",
  "source": {
    "title": "Starfinder Player Core",
    "date": "2025-07",
    "url": "https://2e.aonsrd.com/classes/2-mystic"
  },
  "group": "spellcasters",
  "keyAttributes": [
    "wis"
  ],
  "traditions": [
    "divine",
    "occult",
    "primal"
  ],
  "traditionsChosen": true,
  "casting": "spontaneous",
  "hp": 6,
  "ratings": {
    "offense": [
      2,
      4
    ],
    "defense": 2,
    "support": 5,
    "utility": 4,
    "difficulty": 3.5
  },
  "features": [
    {
      "title": "Spiritual connection",
      "text": "Mystics draw divine, occult or primal magic from their connection. They can bond with up to ten other creatures and sense when those companions need help."
    },
    {
      "title": "Vitality network",
      "text": "Transfer healing from a shared reserve to yourself or a bonded ally. The reserve replenishes each turn in combat and refills when you Refocus."
    }
  ],
  "iconic": {
    "name": "Chk Chk",
    "ancestry": "shirren"
  },
  "art": {
    "emblem": "../../../emblems/mystic.svg",
    "paizo": {
      "pack": "cup-sf2e-iconics",
      "file": "PNG/Mystic - Chk Chk.png"
    },
    "local": "mystic"
  },
  "links": {
    "archivesOfNethys": "https://2e.aonsrd.com/classes/2-mystic"
  },
  "review": {
    "reviewedOn": "2026-10-05",
    "rulesVersion": "Starfinder Player Core",
    "sources": [
      "https://2e.aonsrd.com/classes/2-mystic"
    ],
    "notes": "Original September 2026 numbers retained for comparison; corrected summaries and class families. These scores predate the revised rubric.",
    "ratings": {
      "offense": "Historical score: 2–4. Preserved from the original project dataset; consult the revised set for a current rationale.",
      "defense": "Historical score: 2. Preserved from the original project dataset; consult the revised set for a current rationale.",
      "support": "Historical score: 5. Preserved from the original project dataset; consult the revised set for a current rationale.",
      "utility": "Historical score: 4. Preserved from the original project dataset; consult the revised set for a current rationale.",
      "difficulty": "Historical score: 3.5. Preserved from the original project dataset; consult the revised set for a current rationale."
    }
  }
}
