{
  "$schema": "../../../../schema/class.schema.json",
  "id": "wizard",
  "name": "Wizard",
  "status": "core",
  "source": {
    "title": "Player Core",
    "date": "2023-11",
    "url": "https://2e.aonprd.com/Classes.aspx?ID=39"
  },
  "group": "spellcasters",
  "keyAttributes": [
    "int"
  ],
  "traditions": [
    "arcane"
  ],
  "casting": "prepared",
  "hp": 6,
  "ratings": {
    "offense": 3,
    "defense": 1,
    "support": 4.5,
    "utility": 5,
    "difficulty": 3.5
  },
  "features": [
    {
      "title": "Arcane scholar",
      "text": "Prepare spells from a growing spellbook. You can specialize in damage, control or exploration, but the spells you prepare determine which answers you have today."
    },
    {
      "title": "School and thesis",
      "text": "Your curriculum and thesis shape your tools. A bonded item can recover a spell you have already used, giving limited flexibility when plans change."
    }
  ],
  "iconic": {
    "name": "Ezren",
    "ancestry": "human"
  },
  "art": {
    "emblem": "../../../emblems/wizard.svg",
    "paizo": {
      "pack": "cup-pf2e-iconics",
      "file": "PNG/Wizard - Ezren.png"
    },
    "local": "wizard"
  },
  "links": {
    "archivesOfNethys": "https://2e.aonprd.com/Classes.aspx?ID=39"
  },
  "review": {
    "reviewedOn": "2026-10-05",
    "rulesVersion": "Player Core",
    "sources": [
      "https://2e.aonprd.com/Classes.aspx?ID=39"
    ],
    "notes": "Original September 2026 numbers retained for comparison; corrected summaries and class families. These scores predate the revised rubric.",
    "ratings": {
      "offense": "Historical score: 3. Preserved from the original project dataset; consult the revised set for a current rationale.",
      "defense": "Historical score: 1. Preserved from the original project dataset; consult the revised set for a current rationale.",
      "support": "Historical score: 4.5. Preserved from the original project dataset; consult the revised set for a current rationale.",
      "utility": "Historical score: 5. Preserved from the original project dataset; consult the revised set for a current rationale.",
      "difficulty": "Historical score: 3.5. Preserved from the original project dataset; consult the revised set for a current rationale."
    }
  }
}
