{
  "$schema": "../../schema/class.schema.json",
  "id": "necromancer",
  "name": "Necromancer",
  "status": "expansion",
  "source": {
    "title": "Impossible Magic",
    "date": "2026-07"
  },
  "group": "high-magic",
  "keyAttributes": [
    "int"
  ],
  "traditions": [
    "occult"
  ],
  "casting": "prepared",
  "hp": 8,
  "ratings": {
    "offense": 3.5,
    "defense": 2,
    "support": [
      3,
      4
    ],
    "utility": 4,
    "difficulty": 4.5
  },
  "features": [
    {
      "title": "Master of the dead",
      "text": "Necromancers study occult magic to command the dead. They prepare spells of life and death and raise fragile undead thralls."
    },
    {
      "title": "Thralls",
      "text": "Place thralls to help allies flank, then destroy them to fuel spells. Creatures can pass through them, and they act only through necromancer abilities."
    }
  ],
  "iconic": {
    "name": "Usharak"
  },
  "art": {
    "emblem": "../emblems/necromancer.svg",
    "local": "necromancer"
  },
  "links": {
    "archivesOfNethys": "https://2e.aonprd.com/Classes.aspx?ID=75"
  }
}
