{
  "$schema": "../../../../schema/class.schema.json",
  "id": "psychic",
  "name": "Psychic",
  "status": "expansion",
  "source": {
    "title": "Dark Archives (Remastered)",
    "date": "2026-02",
    "url": "https://2e.aonprd.com/Classes.aspx?ID=68"
  },
  "group": "spellcasters",
  "keyAttributes": [
    "int",
    "cha"
  ],
  "traditions": [
    "occult"
  ],
  "casting": "spontaneous",
  "hp": 6,
  "ratings": {
    "offense": 4,
    "defense": 1,
    "support": 4,
    "utility": 3,
    "difficulty": 3.5
  },
  "features": [
    {
      "title": "Mind over matter",
      "text": "Occult spells and enhanced psi cantrips express your conscious mind. Some choices favor burst damage; others emphasize protection, movement or mental tricks."
    },
    {
      "title": "Amps and psyche",
      "text": "Spend focus points to amp psi cantrips. Unleash your psyche for a short surge of spell damage and special actions, followed by a recovery period with the stupefied condition."
    }
  ],
  "iconic": {
    "name": "Thaleon"
  },
  "art": {
    "emblem": "../../../emblems/psychic.svg",
    "paizo": {
      "pack": "cup-pf2e-iconics",
      "file": "PNG/Psychic - Thaleon.png"
    },
    "local": "psychic"
  },
  "links": {
    "archivesOfNethys": "https://2e.aonprd.com/Classes.aspx?ID=68"
  },
  "review": {
    "reviewedOn": "2026-10-05",
    "rulesVersion": "Dark Archives (Remastered)",
    "sources": [
      "https://2e.aonprd.com/Classes.aspx?ID=68"
    ],
    "notes": "Original September 2026 numbers retained for comparison; corrected summaries and class families. These scores predate the revised rubric.",
    "ratings": {
      "offense": "Historical score: 4. Preserved from the original project dataset; consult the revised set for a current rationale.",
      "defense": "Historical score: 1. Preserved from the original project dataset; consult the revised set for a current rationale.",
      "support": "Historical score: 4. Preserved from the original project dataset; consult the revised set for a current rationale.",
      "utility": "Historical score: 3. Preserved from the original project dataset; consult the revised set for a current rationale.",
      "difficulty": "Historical score: 3.5. Preserved from the original project dataset; consult the revised set for a current rationale."
    }
  }
}
