{
  "$schema": "../../../../schema/class.schema.json",
  "id": "summoner",
  "name": "Summoner",
  "status": "expansion",
  "source": {
    "title": "Impossible Magic",
    "date": "2026-07",
    "url": "https://2e.aonprd.com/Classes.aspx?ID=77"
  },
  "group": "specialist",
  "keyAttributes": [
    "cha"
  ],
  "traditions": [
    "arcane",
    "divine",
    "occult",
    "primal"
  ],
  "traditionsChosen": true,
  "casting": "spontaneous",
  "hp": 10,
  "ratings": {
    "offense": 4,
    "defense": 3,
    "support": 3.5,
    "utility": 3,
    "difficulty": 4.5
  },
  "features": [
    {
      "title": "Two bodies, one team",
      "text": "Share a life force with an eidolon while combining its martial abilities with your spellcasting. Eidolon choice determines your tradition and many of your options."
    },
    {
      "title": "Act Together",
      "text": "Coordinate both bodies to gain an additional single action once per round. You share hit points and attack penalties, so protecting both positions and planning actions are essential."
    }
  ],
  "iconic": {
    "name": "Ija"
  },
  "art": {
    "emblem": "../../../emblems/summoner.svg",
    "paizo": {
      "pack": "cup-pf2e-iconics",
      "file": "PNG/Summoner - Ija.png"
    },
    "local": "summoner"
  },
  "links": {
    "archivesOfNethys": "https://2e.aonprd.com/Classes.aspx?ID=77"
  },
  "review": {
    "reviewedOn": "2026-10-05",
    "rulesVersion": "Impossible Magic",
    "sources": [
      "https://2e.aonprd.com/Classes.aspx?ID=77"
    ],
    "notes": "Original September 2026 numbers retained for comparison; corrected summaries and class families. These scores predate the revised rubric.",
    "ratings": {
      "offense": "Historical score: 4. Preserved from the original project dataset; consult the revised set for a current rationale.",
      "defense": "Historical score: 3. Preserved from the original project dataset; consult the revised set for a current rationale.",
      "support": "Historical score: 3.5. Preserved from the original project dataset; consult the revised set for a current rationale.",
      "utility": "Historical score: 3. Preserved from the original project dataset; consult the revised set for a current rationale.",
      "difficulty": "Historical score: 4.5. Preserved from the original project dataset; consult the revised set for a current rationale."
    }
  }
}
