{
  "$schema": "../../schema/class.schema.json",
  "id": "soldier",
  "name": "Soldier",
  "status": "core",
  "source": {
    "title": "Starfinder Player Core",
    "date": "2025-07",
    "url": "https://2e.aonsrd.com/classes/5-soldier"
  },
  "group": "tech",
  "keyAttributes": [
    "con"
  ],
  "traditions": [],
  "casting": null,
  "hp": 10,
  "ratings": {
    "offense": [
      3.5,
      5
    ],
    "defense": 5,
    "support": [
      3,
      4
    ],
    "utility": 2,
    "difficulty": 3
  },
  "features": [
    {
      "title": "Armored firepower",
      "text": "Soldiers wear heavy armor and use area weapons to attack groups. Enemies that fail their saves become suppressed, slowing them and spoiling their aim."
    },
    {
      "title": "Primary target",
      "text": "Before an area attack, make an extra Strike against the nearest creature in its cone or line, or the one nearest a burst's center."
    }
  ],
  "iconic": {
    "name": "Obozaya",
    "ancestry": "vesk"
  },
  "art": {
    "emblem": "../emblems/soldier.svg",
    "paizo": {
      "pack": "cup-sf2e-iconics",
      "file": "PNG/Soldier - Obozaya.png"
    },
    "local": "soldier"
  },
  "links": {
    "archivesOfNethys": "https://2e.aonsrd.com/classes/5-soldier"
  },
  "review": {
    "reviewedOn": "2026-10-05",
    "rulesVersion": "Starfinder Player Core",
    "sources": [
      "https://2e.aonsrd.com/classes/5-soldier"
    ],
    "notes": "Editorial assessment of the class framework and ordinary builds. Rules references support mechanics; scores remain judgments.",
    "ratings": {
      "offense": "3–4.5 → 3.5–5. Area weapons and close-quarters choices deliver different strong damage patterns; area offense can reach the top band.",
      "defense": "5 → 5. High HP and heavy armor make absorbing punishment a defining strength.",
      "support": "3 → 3–4. Suppression and chosen feats interfere with enemies and protect allies.",
      "utility": "2 → 2. Most class features emphasize combat rather than broad exploration.",
      "difficulty": "3 → 3. Place areas safely, track suppression and choose priority targets."
    }
  }
}
